metric_name,metric_type,interval,unit_name,per_unit_name,description,orientation,integration,short_name
federatorai.integration.status,gauge,,,,integration status for showing Federator.ai health status.,0,federatorai,
federatorai.recommendation,gauge,,,,recommended deployment/statefulset replicas.,0,federatorai,
federatorai.prediction.kafka,gauge,,,,workload prediction for Kafka metrics.,0,federatorai,
federatorai.kafka.broker_offset_rate,gauge,,,,The delta of kafka.broker_offset timeseries in one minute.,0,federatorai,
federatorai.kafka.consumer_offset_rate,gauge,,,,The delta of kafka.consumer_offset timeseries in one minute.,0,federatorai,
