metric_name,metric_type,interval,unit_name,per_unit_name,description,orientation,integration,short_name,curated_metric
fiddler.accuracy,gauge,,percent,,The accuracy of the model,0,fiddler,accuracy,
fiddler.prediction_drift,gauge,,percent,,The prediction drift of the model,0,fiddler,prediction_drift,
fiddler.histogram_drift,gauge,,percent,,The histogram drift of the model,0,fiddler,histogram_drift,
fiddler.feature_average,gauge,,percent,,The feature average of the model,0,fiddler,feature_averge,
fiddler.output_average,gauge,,percent,,The output average of the model,0,fiddler,output_average,
fiddler.traffic_count,gauge,,percent,,The traffic count of the model,0,fiddler,traffic_count,
