metric_name,metric_type,interval,unit_name,per_unit_name,description,orientation,integration,short_name,curated_metric
rdse.bdb_avg_latency,gauge,15,second,,Average latency of operations on the DB (seconds); returned only when there is traffic,-1,redis_enterprise_v2,bdb_avg_latency,
rdse.bdb_avg_latency_max,gauge,15,second,,Highest value of average latency of operations on the DB (seconds); returned only when there is traffic,1,redis_enterprise_v2,bdb_avg_latency_max,
rdse.bdb_avg_read_latency,gauge,15,second,,Average latency of read operations (seconds); returned only when there is traffic,-1,redis_enterprise_v2,bdb_avg_read_latency,
rdse.bdb_avg_read_latency_max,gauge,15,second,,Highest value of average latency of read operations (seconds);returned only when there is traffic,1,redis_enterprise_v2,bdb_avg_read_latency_max,
rdse.bdb_avg_write_latency,gauge,15,second,,Average latency of write operations (seconds); returned only when there is traffic,-1,redis_enterprise_v2,bdb_avg_write_latency,
rdse.bdb_avg_write_latency_max,gauge,15,second,,Highest value of average latency of write operations (seconds); returned only when there is traffic,1,redis_enterprise_v2,bdb_avg_write_latency_max,
rdse.bdb_conns,gauge,15,connection,,Number of client connections to DB,0,redis_enterprise_v2,bdb_conns,
rdse.bdb_egress_bytes,gauge,15,second,,Rate of outgoing network traffic from the DB (bytes/sec),0,redis_enterprise_v2,bdb_egress_bytes,
rdse.bdb_egress_bytes_max,gauge,15,second,,Highest value of rate of outgoing network traffic from the DB (bytes/sec),1,redis_enterprise_v2,bdb_egress_bytes_max,
rdse.bdb_evicted_objects,gauge,15,eviction,,Rate of key evictions from DB (evictions/sec),0,redis_enterprise_v2,bdb_evicted_objects,
rdse.bdb_evicted_objects_max,gauge,15,eviction,,Highest value of rate of key evictions from DB (evictions/sec),1,redis_enterprise_v2,bdb_evicted_objects_max,
rdse.bdb_expired_objects,gauge,15,eviction,,Rate keys expired in DB (expirations/sec),0,redis_enterprise_v2,bdb_expired_objects,
rdse.bdb_expired_objects_max,gauge,15,eviction,,eventHighest value of rate keys expired in DB (expirations/sec),1,redis_enterprise_v2,bdb_expired_objects_max,
rdse.bdb_fork_cpu_system,gauge,15,cpu,,% cores utilization in system mode for all redis shard fork child processes of this database,0,redis_enterprise_v2,bdb_fork_cpu_system,
rdse.bdb_fork_cpu_system_max,gauge,15,cpu,,Highest value of % cores utilization in system mode for all redis shard fork child processes of this database,1,redis_enterprise_v2,bdb_fork_cpu_system_max,
rdse.bdb_fork_cpu_user,gauge,15,cpu,,% cores utilization in user mode for all redis shard fork child processes of this database,0,redis_enterprise_v2,bdb_fork_cpu_user,
rdse.bdb_fork_cpu_user_max,gauge,15,cpu,,Highest value of % cores utilization in user mode for all redis shard fork child processes of this database,1,redis_enterprise_v2,bdb_fork_cpu_user_max,
rdse.bdb_ingress_bytes,gauge,15,second,,Rate of incoming network traffic to DB (bytes/sec),0,redis_enterprise_v2,bdb_ingress_bytes,
rdse.bdb_ingress_bytes_max,gauge,15,second,,Highest value of rate of incoming network traffic to DB (bytes/sec),1,redis_enterprise_v2,bdb_ingress_bytes_max,
rdse.bdb_instantaneous_ops_per_sec,gauge,15,operation,,Request rate handled by all shards of DB (ops/sec),0,redis_enterprise_v2,bdb_instantaneous_ops_per_sec,
rdse.bdb_main_thread_cpu_system,gauge,15,cpu,,% cores utilization in system mode for all redis shard main threas of this database,0,redis_enterprise_v2,bdb_main_thread_cpu_system,
rdse.bdb_main_thread_cpu_system_max,gauge,15,cpu,,Highest value of % cores utilization in system mode for all redis shard main threas of this database,1,redis_enterprise_v2,bdb_main_thread_cpu_system_max,
rdse.bdb_main_thread_cpu_user,gauge,15,cpu,,% cores utilization in user mode for all redis shard main threads of this database,0,redis_enterprise_v2,bdb_main_thread_cpu_user,
rdse.bdb_main_thread_cpu_user_max,gauge,15,cpu,,Highest value of % cores utilization in user mode for all redis shard main threads of this database,1,redis_enterprise_v2,bdb_main_thread_cpu_user_max,
rdse.bdb_mem_frag_ratio,gauge,15,percent,,RAM fragmentation ratio (RSS / allocated RAM),0,redis_enterprise_v2,bdb_mem_frag_ratio,
rdse.bdb_mem_size_lua,gauge,15,byte,,Redis lua scripting heap size (bytes),0,redis_enterprise_v2,bdb_mem_size_lua,
rdse.bdb_memory_limit,gauge,15,byte,,Configured RAM limit for the database (bytes),0,redis_enterprise_v2,bdb_memory_limit,
rdse.bdb_monitor_sessions_count,gauge,15,session,,Number of client connected in monitor mode to the DB,1,redis_enterprise_v2,bdb_monitor_sessions_count,
rdse.bdb_no_of_keys,gauge,15,key,,Number of keys in DB,0,redis_enterprise_v2,bdb_no_of_keys,
rdse.bdb_other_req,gauge,15,request,,Rate of other (non read/write) requests on DB (ops/sec),0,redis_enterprise_v2,bdb_other_req,
rdse.bdb_other_req_max,gauge,15,request,,Highest value of rate of other (non read/write) requests on DB (ops/sec),1,redis_enterprise_v2,bdb_other_req_max,
rdse.bdb_other_res,gauge,15,response,,Rate of other (non read/write) responses on DB (ops/sec),0,redis_enterprise_v2,bdb_other_res,
rdse.bdb_other_res_max,gauge,15,response,,Highest value of rate of other (non read/write) responses on DB (ops/sec),1,redis_enterprise_v2,bdb_other_res_max,
rdse.bdb_pubsub_channels,gauge,15,key,,Count the pub/sub channels with subscribed clients,0,redis_enterprise_v2,bdb_pubsub_channels,
rdse.bdb_pubsub_channels_max,gauge,15,key,,Highest value of count the pub/sub channels with subscribed clients,1,redis_enterprise_v2,bdb_pubsub_channels_max,
rdse.bdb_pubsub_patterns,gauge,15,key,,Count the pub/sub patterns with subscribed clients,0,redis_enterprise_v2,bdb_pubsub_patterns,
rdse.bdb_pubsub_patterns_max,gauge,15,key,,Highest value of count the pub/sub patterns with subscribed clients,1,redis_enterprise_v2,bdb_pubsub_patterns_max,
rdse.bdb_read_hits,gauge,15,hit,,Rate of read operations accessing an existing key (ops/sec),0,redis_enterprise_v2,bdb_read_hits,
rdse.bdb_read_hits_max,gauge,15,hit,,Highest value of rate of read operations accessing an existing key (ops/sec),1,redis_enterprise_v2,bdb_read_hits_max,
rdse.bdb_read_misses,gauge,15,miss,,Rate of read operations accessing a non-existing key (ops/sec),0,redis_enterprise_v2,bdb_read_misses,
rdse.bdb_read_misses_max,gauge,15,miss,,Highest value of rate of read operations accessing a non-existing key (ops/sec),1,redis_enterprise_v2,bdb_read_misses_max,
rdse.bdb_read_req,gauge,15,request,,Rate of read requests on DB (ops/sec),0,redis_enterprise_v2,bdb_read_req,
rdse.bdb_read_req_max,gauge,15,request,,Highest value of rate of read requests on DB (ops/sec),1,redis_enterprise_v2,bdb_read_req_max,
rdse.bdb_read_res,gauge,15,response,,Rate of read responses on DB (ops/sec),0,redis_enterprise_v2,bdb_read_res,
rdse.bdb_read_res_max,gauge,15,response,,Highest value of rate of read responses on DB (ops/sec),1,redis_enterprise_v2,bdb_read_res_max,
rdse.bdb_shard_cpu_system,gauge,15,cpu,,% cores utilization in system mode for all redis shard processes of this database,0,redis_enterprise_v2,bdb_shard_cpu_system,
rdse.bdb_shard_cpu_system_max,gauge,15,cpu,,Highest value of % cores utilization in system mode for all redis shard processes of this database,1,redis_enterprise_v2,bdb_shard_cpu_system_max,
rdse.bdb_shard_cpu_user,gauge,15,cpu,,% cores utilization in user mode for the redis shard process,0,redis_enterprise_v2,bdb_shard_cpu_user,
rdse.bdb_shard_cpu_user_max,gauge,15,cpu,,Highest value of % cores utilization in user mode for the redis shard process,1,redis_enterprise_v2,bdb_shard_cpu_user_max,
rdse.bdb_total_connections_received,gauge,15,connection,,Rate of new client connections to DB (connections/sec),0,redis_enterprise_v2,bdb_total_connections_received,
rdse.bdb_total_connections_received_max,gauge,15,connection,,Highest value of rate of new client connections to DB (connections/sec),1,redis_enterprise_v2,bdb_total_connections_received_max,
rdse.bdb_total_req,gauge,15,request,,Rate of all requests on DB (ops/sec),0,redis_enterprise_v2,bdb_total_req,
rdse.bdb_total_req_max,gauge,15,request,,Highest value of rate of all requests on DB (ops/sec),1,redis_enterprise_v2,bdb_total_req_max,
rdse.bdb_total_res,gauge,15,response,,Rate of all responses on DB (ops/sec),0,redis_enterprise_v2,bdb_total_res,
rdse.bdb_total_res_max,gauge,15,response,,Highest value of rate of all responses on DB (ops/sec),1,redis_enterprise_v2,bdb_total_res_max,
rdse.bdb_up,gauge,15,service,,Database is up and running,0,redis_enterprise_v2,bdb_up,
rdse.bdb_used_memory,gauge,15,byte,,Memory used by db (in bigredis this includes flash) (bytes),0,redis_enterprise_v2,bdb_used_memory,
rdse.bdb_write_hits,gauge,15,hit,,Rate of write operations accessing an existing key (ops/sec),0,redis_enterprise_v2,bdb_write_hits,
rdse.bdb_write_hits_max,gauge,15,hit,,Highest value of rate of write operations accessing an existing key (ops/sec),1,redis_enterprise_v2,bdb_write_hits_max,
rdse.bdb_write_misses,gauge,15,miss,,Rate of write operations accessing a non-existing key (ops/sec),0,redis_enterprise_v2,bdb_write_misses,
rdse.bdb_write_misses_max,gauge,15,miss,,Highest value of rate of write operations accessing a non-existing key (ops/sec),1,redis_enterprise_v2,bdb_write_misses_max,
rdse.bdb_write_req,gauge,15,request,,Rate of write requests on DB (ops/sec),0,redis_enterprise_v2,bdb_write_req,
rdse.bdb_write_req_max,gauge,15,request,,Highest value of rate of write requests on DB (ops/sec),1,redis_enterprise_v2,bdb_write_req_max,
rdse.bdb_write_res,gauge,15,response,,Rate of write responses on DB (ops/sec),0,redis_enterprise_v2,bdb_write_res,
rdse.bdb_write_res_max,gauge,15,response,,Highest value of rate of write responses on DB (ops/sec),1,redis_enterprise_v2,bdb_write_res_max,
rdse.no_of_expires,gauge,15,key,,Current number of volatile keys in the database,0,redis_enterprise_v2,no_of_expires,
rdse.node_available_flash,gauge,15,byte,,Available flash in node (bytes),0,redis_enterprise_v2,node_available_flash,
rdse.node_available_flash_no_overbooking,gauge,15,byte,,"Available flash in node (bytes), without taking into account overbooking",0,redis_enterprise_v2,node_available_flash_no_overbooking,
rdse.node_available_memory,gauge,15,byte,,Amount of free memory in node (bytes) that is available for database provisioning,0,redis_enterprise_v2,node_available_memory,
rdse.node_available_memory_no_overbooking,gauge,15,byte,,Available ram in node (bytes) without taking into account overbooking,0,redis_enterprise_v2,node_available_memory_no_overbooking,
rdse.node_avg_latency,gauge,15,second,,Average latency of requests handled by endpoints on node (seconds); returned only when there is traffic,-1,redis_enterprise_v2,node_avg_latency,
rdse.node_bigstore_free,gauge,15,byte,,Sum of free space of back-end flash (used by flash DB’s [BigRedis]) on all cluster nodes (bytes); returned only when BigRedis is enabled,0,redis_enterprise_v2,node_bigstore_free,
rdse.node_bigstore_iops,gauge,15,operation,,Rate of i/o operations against back-end flash for all shards which are part of a flash based DB (BigRedis) in cluster (ops/sec),0,redis_enterprise_v2,node_bigstore_iops,
rdse.node_bigstore_kv_ops,gauge,15,operation,,Rate of value read/write operations against back-end flash for all shards which are part of a flash based DB (BigRedis) in cluster (ops/sec),0,redis_enterprise_v2,node_bigstore_kv_ops,
rdse.node_bigstore_throughput,gauge,15,operation,,Throughput i/o operations against back-end flash for all shards which are part of a flash based DB (BigRedis) in cluster (bytes/sec),0,redis_enterprise_v2,node_bigstore_throughput,
rdse.node_conns,gauge,15,connection,,Number of clients connected to endpoints on node,0,redis_enterprise_v2,node_conns,
rdse.node_cpu_idle,gauge,15,cpu,,"CPU idle time portion (0-1, multiply by 100 to get percent)",0,redis_enterprise_v2,node_cpu_idle,
rdse.node_cpu_idle_max,gauge,15,cpu,,"Highest value of CPU idle time portion (0-1, multiply by 100 to get percent)",1,redis_enterprise_v2,node_cpu_idle_max,
rdse.node_cpu_idle_median,gauge,15,cpu,,"Average value of CPU idle time portion (0-1, multiply by 100 to get percent)",0,redis_enterprise_v2,node_cpu_idle_median,
rdse.node_cpu_idle_min,gauge,15,cpu,,"Lowest value of CPU idle time portion (0-1, multiply by 100 to get percent)",-1,redis_enterprise_v2,node_cpu_idle_min,
rdse.node_cpu_iowait,gauge,15,cpu,,"CPU IO wait time portion (0-1, multiply by 100 to get percent)",0,redis_enterprise_v2,node_cpu_iowait,
rdse.node_cpu_iowait_max,gauge,15,cpu,,"Highest value of CPU IO wait time portion (0-1, multiply by 100 to get percent)",1,redis_enterprise_v2,node_cpu_iowait_max,
rdse.node_cpu_iowait_median,gauge,15,cpu,,"Average value of CPU IO wait time portion (0-1, multiply by 100 to get percent)",0,redis_enterprise_v2,node_cpu_iowait_median,
rdse.node_cpu_iowait_min,gauge,15,cpu,,"Lowest value of CPU IO wait time portion (0-1, multiply by 100 to get percent)",-1,redis_enterprise_v2,node_cpu_iowait_min,
rdse.node_cpu_irqs,gauge,15,cpu,,"CPU IRQ time portion (0-1, multiply by 100 to get percent)",0,redis_enterprise_v2,node_cpu_irqs,
rdse.node_cpu_irqs_max,gauge,15,cpu,,"Highest value of CPU IRQ time portion (0-1, multiply by 100 to get percent)",1,redis_enterprise_v2,node_cpu_irqs_max,
rdse.node_cpu_irqs_median,gauge,15,cpu,,"Average value of CPU IRQ time portion (0-1, multiply by 100 to get percent)",0,redis_enterprise_v2,node_cpu_irqs_median,
rdse.node_cpu_irqs_min,gauge,15,cpu,,"Lowest value of CPU IRQ time portion (0-1, multiply by 100 to get percent)",-1,redis_enterprise_v2,node_cpu_irqs_min,
rdse.node_cpu_nice,gauge,15,cpu,,"CPU nice time portion (0-1, multiply by 100 to get percent)",0,redis_enterprise_v2,node_cpu_nice,
rdse.node_cpu_nice_max,gauge,15,cpu,,"Highest value of CPU nice time portion (0-1, multiply by 100 to get percent)",1,redis_enterprise_v2,node_cpu_nice_max,
rdse.node_cpu_nice_median,gauge,15,cpu,,"Average value of CPU nice time portion (0-1, multiply by 100 to get percent)",0,redis_enterprise_v2,node_cpu_nice_median,
rdse.node_cpu_nice_min,gauge,15,cpu,,"Lowest value of CPU nice time portion (0-1, multiply by 100 to get percent)",-1,redis_enterprise_v2,node_cpu_nice_min,
rdse.node_cpu_steal,gauge,15,cpu,,"CPU time portion spent in kernel (0-1, multiply by 100 to get percent)",0,redis_enterprise_v2,node_cpu_steal,
rdse.node_cpu_steal_max,gauge,15,cpu,,"Highest value of CPU time portion spent in kernel (0-1, multiply by 100 to get percent)",1,redis_enterprise_v2,node_cpu_steal_max,
rdse.node_cpu_steal_median,gauge,15,cpu,,"Average value of CPU time portion spent in kernel (0-1, multiply by 100 to get percent)",0,redis_enterprise_v2,node_cpu_steal_median,
rdse.node_cpu_steal_min,gauge,15,cpu,,"Lowest value of CPU time portion spent in kernel (0-1, multiply by 100 to get percent)",-1,redis_enterprise_v2,node_cpu_steal_min,
rdse.node_cpu_system,gauge,15,cpu,,"CPU time portion spent by kernel-space processes (0-1, multiply by 100 to get percent)",0,redis_enterprise_v2,node_cpu_system,
rdse.node_cpu_system_max,gauge,15,cpu,,"Highest value of CPU time portion spent by kernel-space processes (0-1, multiply by 100 to get percent)",1,redis_enterprise_v2,node_cpu_system_max,
rdse.node_cpu_system_median,gauge,15,cpu,,"Average value of CPU time portion spent by kernel-space processes (0-1, multiply by 100 to get percent)",0,redis_enterprise_v2,node_cpu_system_median,
rdse.node_cpu_system_min,gauge,15,cpu,,"Lowest value of CPU time portion spent by kernel-space processes (0-1, multiply by 100 to get percent)",-1,redis_enterprise_v2,node_cpu_system_min,
rdse.node_cpu_user,gauge,15,cpu,,"CPU time portion spent by user-space processes (0-1, multiply by 100 to get percent)",0,redis_enterprise_v2,node_cpu_user,
rdse.node_cpu_user_max,gauge,15,cpu,,"Highest value of CPU time portion spent by user-space processes (0-1, multiply by 100 to get percent)",1,redis_enterprise_v2,node_cpu_user_max,
rdse.node_cpu_user_median,gauge,15,cpu,,"Average value of CPU time portion spent by user-space processes (0-1, multiply by 100 to get percent)",0,redis_enterprise_v2,node_cpu_user_median,
rdse.node_cpu_user_min,gauge,15,cpu,,"Lowest value of CPU time portion spent by user-space processes (0-1, multiply by 100 to get percent)",-1,redis_enterprise_v2,node_cpu_user_min,
rdse.node_cur_aof_rewrites,gauge,15,write,,Number of aof rewrites that are currently performed by shards on this node,0,redis_enterprise_v2,node_cur_aof_rewrites,
rdse.node_egress_bytes,gauge,15,byte,,Rate of outgoing network traffic to node (bytes/sec),0,redis_enterprise_v2,node_egress_bytes,
rdse.node_egress_bytes_max,gauge,15,byte,,Highest value of rate of outgoing network traffic to node (bytes/sec),1,redis_enterprise_v2,node_egress_bytes_max,
rdse.node_egress_bytes_median,gauge,15,byte,,Average value of rate of outgoing network traffic to node (bytes/sec),0,redis_enterprise_v2,node_egress_bytes_median,
rdse.node_egress_bytes_min,gauge,15,byte,,Lowest value of rate of outgoing network traffic to node (bytes/sec),-1,redis_enterprise_v2,node_egress_bytes_min,
rdse.node_ephemeral_storage_avail,gauge,15,byte,,Disk space available to RLEC processes on configured ephemeral disk (bytes),0,redis_enterprise_v2,node_ephemeral_storage_avail,
rdse.node_ephemeral_storage_free,gauge,15,byte,,Free disk space on configured ephemeral disk (bytes),0,redis_enterprise_v2,node_ephemeral_storage_free,
rdse.node_free_memory,gauge,15,byte,,Free memory in node (bytes),0,redis_enterprise_v2,node_free_memory,
rdse.node_ingress_bytes,gauge,15,byte,,Rate of incoming network traffic to node (bytes/sec),0,redis_enterprise_v2,node_ingress_bytes,
rdse.node_ingress_bytes_max,gauge,15,byte,,Highest value of rate of incoming network traffic to node (bytes/sec),1,redis_enterprise_v2,node_ingress_bytes_max,
rdse.node_ingress_bytes_median,gauge,15,byte,,Average value of rate of incoming network traffic to node (bytes/sec),0,redis_enterprise_v2,node_ingress_bytes_median,
rdse.node_ingress_bytes_min,gauge,15,byte,,Lowest value of rate of incoming network traffic to node (bytes/sec),-1,redis_enterprise_v2,node_ingress_bytes_min,
rdse.node_persistent_storage_avail,gauge,15,byte,,Disk space available to RLEC processes on configured persistent disk (bytes),0,redis_enterprise_v2,node_persistent_storage_avail,
rdse.node_persistent_storage_free,gauge,15,byte,,Free disk space on configured persistent disk (bytes),0,redis_enterprise_v2,node_persistent_storage_free,
rdse.node_provisional_flash,gauge,15,byte,,"Amount of flash available for new shards on this node, taking into account overbooking, max redis servers, reserved flash and provision and migration thresholds",0,redis_enterprise_v2,node_provisional_flash,
rdse.node_provisional_flash_no_overbooking,gauge,15,byte,,"Amount of flash available for new shards on this node, without taking into account overbooking, max redis servers, reserved flash and provision and migration thresholds",0,redis_enterprise_v2,node_provisional_flash_no_overbooking,
rdse.node_provisional_memory,gauge,15,byte,,Amount of RAM that is available for provisioning to databases out of the total RAM allocated for databases,0,redis_enterprise_v2,node_provisional_memory,
rdse.node_provisional_memory_no_overbooking,gauge,15,byte,,"Amount of RAM that is available for provisioning to databases out of the total RAM allocated for databases, without taking into account overbooking",0,redis_enterprise_v2,node_provisional_memory_no_overbooking,
rdse.node_total_req,gauge,15,request,,Request rate handled by endpoints on node (ops/sec),0,redis_enterprise_v2,node_total_req,
rdse.node_up,gauge,15,service,,Node is part of the cluster and is connected,0,redis_enterprise_v2,node_up,
rdse.redis_active_defrag_running,rate,15,cpu,,Automatic memory defragmentation current aggressiveness (% cpu),0,redis_enterprise_v2,redis_active_defrag_running,
rdse.redis_allocator_active,gauge,15,byte,,Total used memory including external fragmentation,0,redis_enterprise_v2,redis_allocator_active,
rdse.redis_allocator_allocated,gauge,15,byte,,Total allocated memory,0,redis_enterprise_v2,redis_allocator_allocated,
rdse.redis_allocator_resident,gauge,15,byte,,Total resident memory (RSS),0,redis_enterprise_v2,redis_allocator_resident,
rdse.redis_aof_last_cow_size,gauge,15,byte,,"Last AOFR, CopyOnWrite memory",0,redis_enterprise_v2,redis_aof_last_cow_size,
rdse.redis_aof_rewrite_in_progress,gauge,15,check,,The number of simultaneous AOF rewrites that are in progress,0,redis_enterprise_v2,redis_aof_rewrite_in_progress,
rdse.redis_aof_rewrites,gauge,15,write,,Number of AOF rewrites this process executed,0,redis_enterprise_v2,redis_aof_rewrites,
rdse.redis_aof_delayed_fsync,gauge,15,operation,,Number of times an AOF fsync caused delays in the redis main thread (inducing latency); This can indicate that the disk is slow or overloaded,0,redis_enterprise_v2,redis_aof_delayed_fsync,
rdse.redis_blocked_clients,gauge,15,connection,,Count the clients waiting on a blocking call,0,redis_enterprise_v2,redis_blocked_clients,
rdse.redis_connected_clients,gauge,15,connection,,Number of client connections to the specific shard,0,redis_enterprise_v2,redis_connected_clients,
rdse.redis_connected_slaves,gauge,15,connection,,Number of connected slaves,0,redis_enterprise_v2,redis_connected_slaves,
rdse.redis_db0_avg_ttl,gauge,15,key,,Average TTL of all volatile keys,0,redis_enterprise_v2,redis_db0_avg_ttl,
rdse.redis_db0_expires,gauge,15,key,,Total count of volatile keys,1,redis_enterprise_v2,redis_db0_expires,
rdse.redis_db0_keys,gauge,15,key,,Total key count,1,redis_enterprise_v2,redis_db0_keys,
rdse.redis_evicted_keys,gauge,15,key,,Keys evicted so far (since restart),1,redis_enterprise_v2,redis_evicted_keys,
rdse.redis_expire_cycle_cpu_milliseconds,gauge,15,second,,The cumulative amount of time spent on active expiry cycles,1,redis_enterprise_v2,redis_expire_cycle_cpu_milliseconds,
rdse.redis_expired_keys,gauge,15,key,,Keys expired so far (since restart),1,redis_enterprise_v2,redis_expired_keys,
rdse.redis_forwarding_state,gauge,15,check,,Shard forwarding state (on or off),0,redis_enterprise_v2,redis_forwarding_state,
rdse.redis_keys_trimmed,gauge,15,key,,The number of keys that were trimmed in the current or last resharding process,0,redis_enterprise_v2,redis_keys_trimmed,
rdse.redis_keyspace_read_hits,gauge,15,hit,,Number of read operations accessing an existing keyspace,1,redis_enterprise_v2,redis_keyspace_read_hits,
rdse.redis_keyspace_read_misses,gauge,15,miss,,Number of read operations accessing an non-existing keyspace,1,redis_enterprise_v2,redis_keyspace_read_misses,
rdse.redis_keyspace_write_hits,gauge,15,hit,,Number of write operations accessing an existing keyspace,1,redis_enterprise_v2,redis_keyspace_write_hits,
rdse.redis_keyspace_write_misses,gauge,15,miss,,Number of write operations accessing an non-existing keyspace,1,redis_enterprise_v2,redis_keyspace_write_misses,
rdse.redis_master_link_status,gauge,15,check,,Indicates if the replica is connected to its master,0,redis_enterprise_v2,redis_master_link_status,
rdse.redis_master_repl_offset,gauge,15,byte,,Number of bytes sent to replicas by the shard; Calculate the throughput for a time period by comparing the value at different times,0,redis_enterprise_v2,redis_master_repl_offset,
rdse.redis_master_sync_in_progress,gauge,15,check,,The master shard is synchronizing (1 true,0,redis_enterprise_v2,redis_master_sync_in_progress,
rdse.redis_max_process_mem,gauge,15,byte,,Current memory limit configured by redis_mgr according to node free memory,0,redis_enterprise_v2,redis_max_process_mem,
rdse.redis_maxmemory,gauge,15,byte,,Current memory limit configured by redis_mgr according to db memory limits,0,redis_enterprise_v2,redis_maxmemory,
rdse.redis_mem_aof_buffer,gauge,15,byte,,Current size of AOF buffer,0,redis_enterprise_v2,redis_mem_aof_buffer,
rdse.redis_mem_clients_normal,gauge,15,byte,,Current memory used for input and output buffers of non-replica clients,0,redis_enterprise_v2,redis_mem_clients_normal,
rdse.redis_mem_clients_slaves,gauge,15,byte,,Current memory used for input and output buffers of replica clients,0,redis_enterprise_v2,redis_mem_clients_slaves,
rdse.redis_mem_fragmentation_ratio,gauge,15,percent,,Memory fragmentation ratio (1.3 means 30% overhead),0,redis_enterprise_v2,redis_mem_fragmentation_ratio,
rdse.redis_mem_not_counted_for_evict,gauge,15,byte,,Portion of used_memory (in bytes) that’s not counted for eviction and OOM error,0,redis_enterprise_v2,redis_mem_not_counted_for_evict,
rdse.redis_mem_replication_backlog,gauge,15,byte,,Size of replication backlog,0,redis_enterprise_v2,redis_mem_replication_backlog,
rdse.redis_module_fork_in_progress,gauge,15,check,,A binary value that indicates if there is an active fork spawned by a module (1) or not (0),0,redis_enterprise_v2,redis_module_fork_in_progress,
rdse.redis_process_cpu_system_seconds_total,gauge,15,cpu,,Shard Process system CPU time spent in seconds,1,redis_enterprise_v2,redis_process_cpu_system_seconds_total,
rdse.redis_process_cpu_usage_percent,gauge,15,cpu,,Shard Process cpu usage precentage,0,redis_enterprise_v2,redis_process_cpu_usage_percent,
rdse.redis_process_cpu_user_seconds_total,gauge,15,cpu,,Shard user CPU time spent in seconds,1,redis_enterprise_v2,redis_process_cpu_user_seconds_total,
rdse.redis_process_main_thread_cpu_system_seconds_total,gauge,15,cpu,,Shard main thread system CPU time spent in seconds,1,redis_enterprise_v2,redis_process_main_thread_cpu_system_seconds_total,
rdse.redis_process_main_thread_cpu_user_seconds_total,gauge,15,second,,Shard main thread user CPU time spent in seconds,1,redis_enterprise_v2,redis_process_main_thread_cpu_user_seconds_total,
rdse.redis_process_max_fds,gauge,15,file,,Shard Maximum number of open file descriptors,1,redis_enterprise_v2,redis_process_max_fds,
